{
  "name": "code-quality-engine",
  "title": "Code Quality Engine",
  "version": "0.2.0",
  "summary": "Deterministic code review and refactor protocol focused on severity, safe fixes, and test-aware risk control.",
  "type": "rule",
  "activation": {
    "use_when": [
      "Reviewing code for quality or safety",
      "Refactoring for clarity or maintainability",
      "Optimizing performance with real evidence",
      "Reducing complexity in fragile areas",
      "Modernizing legacy code with minimal mutation"
    ],
    "avoid_when": [
      "Only documentation is requested",
      "Test design is the primary task",
      "Infrastructure or deployment is the primary task"
    ]
  },
  "compatibility": [
    "chatgpt",
    "codex",
    "claude-code",
    "cursor",
    "opencode"
  ],
  "risk_level": "medium",
  "requires_network": false,
  "maintainer": "Lukas"
}
